{
  "rules": "",
  "include": [],
  "exclude": [
    "dist/**",
    "build/**",
    "node_modules/**",
    "vendor/**",
    "reports/**",
    "coverage/**",
    "tmp/**",
    ".git/**"
  ],
  "enabledRules": [],
  "disabledRules": [],
  "categories": [],
  "tags": [],
  "severityOverrides": {
    "HMS0010": "Low"
  },
  "failOn": "high",
  "minSeverity": "",
  "suppressionsEnabled": true
}
